Title,Description
"Front End Developer - Plano, TX 75093 - Indeed.com","ACCENTURE's Flexible Workforce  solves clients’ toughest challenges by providing cross-industry expertise, unmatched innovation, World-class tech and talent. We help bring it all together to deliver tangible business outcomes for our clients with contractors and our extended workforce opportunities. Accenture is consistently recognized on FORTUNE’s 100 Best Companies to Work for and Diversity Inc’s Top 50 Companies for Diversity lists. And that's just the beginning. Now is the perfect time for you to consider opportunities through our Flexible Workforce. 
What's In It For You : 
Collaborate with a diverse network of people 
Actively deliver innovative solutions for Accenture's clients 
Apply your skills and experience to help drive business transformation 
Work locally or remotely, significantly reducing or eliminating the demands to travel 
Project Description : 
We are seeking a Front End Developer in Plano, TX . 
Will work remotely then onsite once the restrictions are lifted. 
This is a 12 months contract opportunity that does not offer sponsorship now or in the future 
Must be able to work on W2. 
Responsibilities : 
Multiplatform Front End Development Angular 
Design, build and configure applications to meet business process and application requirements. 
Need resources with good communication and great technical skills like Angular Js V7 and higher, ES6, HTML5/CSS3, Bootstrap. 
Primary skills JavaScript. 
Basic Qualifications : 
Bachelor's Degree. 
Bonus Points If You Have : 
Master's Degree. 
Keywords: JavaScript, Front End Developer 
What We Believe 
We have an unwavering commitment to diversity with the aim that every one of our people has a full sense of belonging within our organization. As a business imperative, every person at Accenture has the responsibility to create and sustain an inclusive environment. 
Inclusion and diversity are fundamental to our culture and core values. Our rich diversity makes us more innovative and more creative, which helps us better serve our clients and our communities.  Read more here 
Equal Employment Opportunity Statement 
 
 
 Accenture is an Equal Opportunity Employer. We believe that no one should be discriminated against because of their differences, such as age, disability, ethnicity, gender, gender identity and expression, religion or sexual orientation. Our rich diversity makes us more innovative, more competitive and more creative, which helps us better serve our clients and our communities. 
 
 
 All employment decisions shall be made without regard to age, race, creed, color, religion, sex, national origin, ancestry, disability status, veteran status, sexual orientation, gender identity or expression, genetic information, marital status, citizenship status or any other basis as protected by federal, state, or local law. 
 
 
 Accenture is committed to providing veteran employment opportunities to our service men and women. 
 
 
 For details, view a copy of the  Accenture Equal Opportunity and Affirmative Action Policy Statement 
 
 
 Requesting An Accommodation 
 
 
 Accenture is committed to providing equal employment opportunities for persons with disabilities or religious observances, including reasonable accommodation when needed. If you are hired by Accenture and require accommodation to perform the essential functions of your role, you will be asked to participate in our reasonable accommodation process. Accommodations made to facilitate the recruiting process are not a guarantee of future or continued accommodations once hired. 
 
 
 If you would like to be considered for employment opportunities with Accenture and have accommodation needs for a disability or religious observance, please call us toll free at  1 (877) 889-9009 , send us an  email  or speak with your recruiter. 
 
 
 Other Employment Statements 
 
 
 Applicants for employment in the US must have work authorization that does not now or in the future require sponsorship of a visa for employment authorization in the United States.
 Candidates who are currently employed by a client of Accenture or an affiliated Accenture business may not be eligible for consideration. 
 
 
 Job candidates will not be obligated to disclose sealed or expunged records of conviction or arrest as part of the hiring process. 
 
 
 The Company will not discharge or in any other manner discriminate against employees or applicants because they have inquired about, discussed, or disclosed their own pay or the pay of another employee or applicant. Additionally, employees who have access to the compensation information of other employees or applicants as a part of their essential job functions cannot disclose the pay of other employees or applicants to individuals who do not otherwise have access to compensation information, unless the disclosure is (a) in response to a formal complaint or charge, (b) in furtherance of an investigation, proceeding, hearing, or action, including an investigation conducted by the employer, or (c) consistent with the Company's legal duty to furnish information."
Front End Developer - California - Indeed.com,"designthis! is excited to be growing and is adding to its team. We are looking for a Front End Web Developer to join our team. This is a great opportunity to be an integral part of a passionate creative team in an exciting and dynamic role. It’s fun, high-energy, and always entertaining. This is a hybrid position – it is combined remote and in-office work that will collaborate with a creative team. About Us We’re a 360-degree branding and design studio with over 25 years of servicing clients of long and new relationships. We’re a multi-talented team that partners with clients to achieve and surpass their business goals. We’re responsive, reliable and attentive to our clients. We’re fun to work with as a team, and we’re always excited to create and build the best work possible every day. Who are we looking for? Attention to detail is your superpower. Pixel­precision, optimization and a flawless user experience are things you take pride in. You have a strong visual aesthetic, strong communication skills, a can-do attitude, and are looking for a high-energy environment that celebrates design thinking and customer experience. Key Responsibilities Work with our developers and designers to conceptualize and build websites, using modern web standards Create custom architecture and solutions for our clients Implement feature and functionality updates to our websites Modify templates and tweak existing sites built on CMS and eCommerce platforms Build and test responsive html emails for campaigns Troubleshoot and assist in resolving technical issues Qualifications/Skills At a minimum you must have at least 5 years of experience as a web developer. We are somewhat flexible as you will grow in this position, but familiarity with most or all of the following technologies is expected, and professional experience with a few is desired: HTML CSS3 SCSS/SASS JS (jQuery/React/Redux/AngularJs) MySQL knowledge and ability to troubleshoot issues Adobe Photoshop and Illustrator familiarity (bonus: Creative Suite familiarity) Github Wordpress (bonus: CraftCMS or similar) Ecommerce (understanding of how environments work and their process) Frameworks (bonus: Bulma or similar) ADA compliancy standards (WCAG 2.1 AA preferred) Browser compatibility (bonus: Mobile compatibility) Email development (bonus: Responsive emails) Self­driven to learn new technologies and apply skills quickly Ability to proactively solve problems both independently and as part of a team Ability to work in an office environment All candidates must work with speed and enjoy the thrill of making deadlines. * To apply, reply to this posting and include a link to your portfolio of work.  Job Type: Full-time Pay: $70,000.00 - $75,000.00 per year Benefits: 401(k) Health insurance Schedule: 8 hour shift Monday to Friday Supplemental Pay: Bonus pay COVID-19 considerations: We have a COVID-19 Cal-OSHA compliant Prevention Plan. We requires masks when in close proximity, have hand sanitizer, sanitizing products and regular cleaning, and plenty of space to keep physically distanced Ability to commute/relocate: California: Reliably commute or planning to relocate before starting work (Preferred) Application Question(s): Are you open to hybrid work? This job involves remote and in-office work in Napa Experience: Web development: 5 years (Required) Work Location: Multiple Locations"
Jr. HTML Front End Developer - Remote - Indeed.com,"Who is Frequence? 
We’re the ones with big ideas, bold vision, and Silicon Valley-casual vibes who are passionate about solving real problems for our clients. 
Frequence’s powerful software makes it easy for media companies to stay competitive in the digital advertising space. We empower experts in sales and ad design with a set of tools that allows them to efficiently deliver what would otherwise be complex advertising strategies. 
Unlike other workflow software, Frequence is the most complete system on the market, connecting all aspects of digital advertising—sales, operations, and reporting—from beginning to end. We create smart, focused campaigns based on performance data from thousands of local and national media campaigns to level the playing field and make programmatic ad buying possible for smaller local businesses. The data is out there, and we want to help advertisers put it to work. 
The Opportunity 
You’re a new developer looking to make some waves in the digital advertising industry. You thrive when tackling challenges and are ready to take on whatever comes your way. Though you’re a developer first, you approach your projects with design in mind. You’re unafraid of diving into new technology and methodology, and you keep up with emerging industries, brands, and design trends. You love to collaborate and are receptive to feedback. 
We’re looking for a bug-smashing HTML wizard to join our creative team and Gartic Phone games. 
As a Jr HTML Developer you will collaborate with the senior design team and the engineering team to help build beautiful digital proposals and websites. 
What You Will Do: 
Frontend development for digital proposals and websites 
Find ways to build beautiful things efficiently 
Interact with creative and engineering team 
Who You Are: 
2-4 years of HTML and Javascript experience or equivalent 
Materializecss - https://materializecss.com/ 
HTML/CSS 
JSON 
Javascript 
Some understanding of backend development 
Aren’t intimidated by a fast-paced, deadline-driven environment. 
Have strong organizational skills 
You leave your ego at the door and enjoy when others do too. 
Nice to Have: 
Eagerness to take ownership 
D3.JS - Building Graphics, SVGs 
Experience with APIs 
Experience with design systems 
Loveable, quirky, kids-at-heart welcome :) 
Why Frequence? 
Frequence has a passion for our people and our mission to help clients grow their business. As our company grows, so does our need to add sharp, ambitious, and talented people to our team. We're approachable, inclusive, and encourage open dialogue within our community. This is a place where your voice matters. 
Want proof that we love our people? Frequence was recognized by Bay Area News Group as a Top Workplaces Company for 2020 & 2021! 
Ways we show our love (some call them benefits): 
Competitive Salary and bonuses 
Stock options at a mid-stage startup, 401K 
Health, dental and vision insurance coverage 
Generous PTO 
Adobe Creative Cloud 
Frequence, Inc. is an Equal Opportunity Employer. At Frequence, Inc. we are deliberately trying to create a safe space for people of all races, genders, ages, backgrounds, and orientations. It is the policy of Frequence, Inc. to provide equal employment opportunity to all persons, regardless of age, race, religion, color, national origin, sex, political affiliations, marital status, non-disqualifying physical or mental disability, age, sexual orientation, membership or non-membership in an employee organization, or on the basis of personal favoritism or other non-merit factors, except where otherwise provided by law. 
 
 qzvhexq7kj"
"Front End Developer (Entry level) - Mesquite, TX - Indeed.com","In the next 4 weeks, Revature is looking to hire over 300 Front End Developers across the country. We are the largest employer of emerging tech talent. 
One day someone is going to ask you where you got your start…This is IT! 
With a wide range of Fortune 500 enterprises, government organizations and top systems integrators as our clients, we not only provide you with the skills needed to succeed through an employer-paid training program but will also give you the opportunity to put those skills to use, on projects that matter . 
What We Are Looking For 
College degree (Associates or Bachelors) 
Must be authorized to work in the US 
Strong desire to learn to code – No prior professional experience required. 
A natural problem solver 
Strong communication and interpersonal skills 
Willing to relocate anywhere in the US – Relocation assistance provided 
What We Offer 
Competitive salary 
Relocation & housing assistance 
Health, vision & dental insurance 
Paid time off 
Industry Certifications 
Life Insurance Policy 
401k 
Mentoring program and ongoing support throughout your entire Revature career 
Experience with the largest and most reputable companies in the US 
Apply Today. Interviews are going on now. 
#SoftwareEngineering 
Equal Employment Opportunity 
The Company is an equal opportunity employer. We will extend equal opportunity to all individuals without regard to race, religion, color, sex, pregnancy, childbirth or related medical conditions, sexual orientation, gender identity, national origin, disability, age, genetic information, marital status, veteran status, or any other status protected under applicable federal, state, or local laws. This policy applies to all terms and conditions of employment, including but not limited to, hiring, placement, promotion, termination, layoff, recall, transfer, leaves of absence, benefits, compensation and training. If you require an accommodation to work based on any of these protected factors, please notify the Human Resources Department, and the Company will evaluate the request and provide an accommodation in accordance with applicable law. 
We seek to comply with all applicable federal, state and local laws related to discrimination and will not tolerate the interference with the ability of any of the Company’s employees to perform their job duties. Our policy reflects and affirms the Company’s commitment to the principles of fair employment and the elimination of all discriminatory practices."
HTML/CSS Front-End Developer - Remote - Indeed.com,"We are looking for an HTML/CSS Developer to join our Front-End Development Team.
 
 Heads up: 
We are as interested in your work experience as we are in the kind of person you are. At Melon we believe there are three key qualities to being a good teammate, as well as client: being smart, delivering results and being nice. This is why beyond your skills, we value character, reason and sense of humor, and we appreciate potential for growth.
 
Our team is supportive, hard-working and friendly and we like to keep it this way. If you would like to join Melon, here is what you will do most of the time:
 
Work on custom projects for clients, sometimes very closely with their team
 
Keep a healthy communication with your project manager and client
 
Take active part in all project stages – analysis, estimation, documentation, coding, bug fixing and support
 
Develop our own products
 
Learn from your colleagues and teach them what you know
 
 Requirements: 
2+ years of experience as a front-end developer
 
Excellent skills in HTML, HTML5, XHTML
 
Excellent skills in CSS
 
 CSS Frameworks:  Bootstrap, Foundation, Bulma, Material UI
 
Responsive designs and animations
 
Cross browser compatibility
 
Experience with Figma/Sketch/Adobe XD, Adobe Photoshop, Adobe Illustrator
 
Experience in at least one of the following - Git, SVN, Mercurial
 
Teamwork experience
 
Good command of English (reading, writing, speaking)
 
 What will give you an edge: 
JS and DOM
 
Experience with agile methodologies
 
Image optimization
 
 Education: 
Bachelor degree in Computer Science or other related fields and/or demonstrated capability through previous experience.
 
 What we offer: 
This is a full-time position that comes with an excellent salary and an opportunity to grow within the company based on demonstrated merit.
 
Flexible working hours and no overtime.
 
Additional health insurance that guarantees fast access to contracted health services.
 
Our training policy for technical and other skills-related events, courses and certifications.
 
Work-from-home.
 
Our performance evaluation policy that paves the roadmap of personal career development.
 
Co-subsidized MultiSport cards, transportation, parking.
 
Refreshments and fruits at our offices.
 
Self-care program that provides individual and team psychological consultations.
 
Annual team building that gathers together the offices from Sofia, Veliko Tarnovo and Skopje.
 
Mini-team buildings and other local company events that run throughout the year.
 
What’s Key about Melon?
 
You get an opportunity to tackle challenging work tasks in a dynamic, but supportive organization. Our company culture is people-oriented and informal. This mix attracts good teammates and interesting clients.
 
To apply, please send your CV with the position reference in the subject. If you have written relevant code, we encourage you to send an example.
 
Your application will be treated with confidentiality.
 
Only shortlisted candidates will be contacted for an interview.
 
Job info
 
 Location:  Remote, Sofia
 
 Contract:  Full-time
 
 Team Size:  22 people"
"Front End Developer - Fort Collins, CO 80528 - Indeed.com","Crafting marketing leadership – one client team at a time 
 
At Refactored, we believe in marketing’s ability to drive business results and organizational change. We also believe that a marketing agency can be a powerful accelerator for building and supporting effective internal marketing teams. By helping our clients mature their approach to marketing, they elevate their practice to a leadership position within their organization. We aim to solve today’s challenges while providing strategies and solutions that build greater capability, improve marketing’s performance, and ensure our work together has a lasting positive impact on their business. 
We have the capability to deliver a broad range of marketing services to most any B2B company. We provide everything from branding and content to digital marketing and website development. However, we prefer to focus on clients who fit a specific profile, are interested in purchasing integrated solutions, and are seeking a longer-term and more impactful partnership. Today, every one of our staff members plays an active and important role in the life of our clients — each delivering their unique contribution to the success of business-critical initiatives. We serve clients by working in close partnership with their executives and SMEs. Clients trust our advice and vision, and we are the strategic center for digital programs that demand creative thinking, integrated problem solving, and ownership. If you want to take a leadership role in the development of new business opportunities to help us create innovative marketing solutions that drive bottom line results — then you’ve found your new home. 
Ready to build something great? 
 
What feels just as good as building a web project that you know is awesome? Seeing that project produce amazing results and a happy client. 
Front End Developer 
We are looking for a talented Front-End Developer to join our team in Northern Colorado to help us serve a growing list of clients. 
 
In this role, you will be working collaboratively with our technology and strategy teams to develop solutions for a full range of digital projects and marketing programs with an emphasis on quality and results for our clients. 
The ideal candidate is a lifelong learner, has an eye for detail, and understands how to write reusable and efficient code following industry best practices. 
Responsibilities 
 
Develop creative, functional, maintainable, and performance-driven web applications, websites, and components. 
 Write high-quality, re-usable code following industry best practices. 
 Contribute to project-based work as well as our internal library of reusable components. 
 Investigate and resolve bugs or deficiencies in project codebase. 
 Provide development estimates for enhancement requests. 
 Complete other duties as assigned. 
 
 
Competencies 
 
In order to flourish in this roll, you will need the following: 
 
 2-4 years commercial experience as a Front-end Engineer 
 Strong JavaScript skills 
 React experience, including knowledge and experience in dealing with state management 
 Strong HTML and CSS (SCSS) Skills 
 Good knowledge of responsive web design 
 Experience with Git or other source control systems 
 Excellent people skills, very client focused 
 Understanding of CI/CD processes 
 A creative and persistent problem-solving approach 
 
 Ideal candidate would also have: 
 
 Some server-side language skills 
 Experience with Static Site Generators (Gatsby, Nextjs, etc) 
 Experience with Azure, AWS, Netlify would be a great advantage 
 Experience with Node 
 Experience with GraphQL 
 Experience developing sites that utilize a Headless CMS (e.g. Contenful, DatoCMS, Sanity.io, Storyblock, Kontent, etc.) 
 Experience developing sites in traditional CMS a plus (Kentico, Wordress, Sitefinity, Drupal, etc). 
 
 
Why come work for us? 
 
It’s amazing when you work for a company that focuses on the success of its clients  and   its employees simultaneously. Our clients are well matched with our culture so that we can focus on delivering quality work within a framework of mutual respect, appropriate and available budgets for the tasks at hand, and a joint understanding of how effective marketing programs should be initiated. For you, this means you’ll be a trusted advisor in the life of our clients, have strategic control over how programs develop and execute, and you’ll be a part of delivering high-impact solutions for our clients. Personally, we’ll provide you a working environment that’s flexible, enjoyable, and professionally rewarding. 
We're a recognized, award-winning agency and have been recognized with 24 Awards in the last 3-years. 
 
2019 Transform Awards - Best Rebrand of a Digital Property 
 2019 ITSMA Marketing Excellence Awards – Finalist: ABM Pilot Program 
 2019 B2 Awards from ANA - Search Advertising and Web Presence 
 2019 Silver Stevie Award - Marketing Solution for Sales & Customer Service 
 2018 Gold Key Awards from BMA Colorado - Best of Show for SEO, Website $150K+, ABM Program 
 
 
We offer— 
 
A competitive salary and paid training 
 Opportunities for professional growth through training, conferences, and continued education 
 Generous vacation time 
 Collaboration with passionate, seasoned professionals 
 A casual, comfortable working environment 
 An easy commute to our office in Windsor, Colorado 
 Monthly team lunches 
 Health, dental, vision and short/long term disability insurance 
 401k with 3% contribution to help you plan for your future 
 
 
Please note, this is not a remote position. Once our offices are re-open from the COVID-19 pandemic closure, this will be a full-time, in person role in our Ft. Collins, CO office. The salary range for this position is between $75,000 and $95,000 and is based on years of experience in a similar role and education."
Front-End Developer - Remote - Indeed.com,"Entry-Level Front-End Developer 
Essential Functions: 
Front-End Developers are responsible for creating new customer websites based on existing designs and creating new pluggable layouts. In addition, the front-end developer works with back-end developers to develop and enhance existing and future web platforms. 
 
 
 Must be able to work alone and in a group. Our product is always changing, and the skills required are becoming more demanding. 
 
 
 Education & Experience: 
Responsive Web Design experience 
Proficiency in HTML5 and CSS3 
Knowledge of CSS preprocessors 
Basic to Intermediate Knowledge of JavaScript 
Proficiency with Mobile friendliness 
Experience with Photoshop
 Excellent UI Sense 
Familiar with cross-platform and cross-browser issues 
Excellent troubleshooting skills 
Detail oriented, self-motivated, disciplined, and organized 
About Dealer Spike: 
Dealer Spike is a digital advertising company focused on helping dealerships in the powersports, RV, marine, and agricultural industries. We provide beautiful, powerful, distinctive web solutions and tools to our dealership clients. Our expertise comes from real-world dealership experience and a passion for listening and responding to our dealers' needs in the marketplace. We're proud to be in the top 20 fastest growing companies in Oregon for the last 4 years, and this year we made it into Inc. Magazine's Inc. 500! 
Dealer Spike has found a blend of the relaxed start-up company culture and fast paced marketing world that somehow works for us. We are a work-hard-play-hard company at our core and we promise our employees that if you take care of us then we will take care of you! 
What we offer: 
Medical, Dental, and Vision Plan 401K with company match Vacation and Sick PTO Wellness program Paid Holidays"
