Title,Description
"Sr. Full Stack Angular Developer - Baltimore, MD - Indeed.com","US CITIZENSHIP REQUIRED FOR THIS POSITION: Yes 
RELOCATION ASSISTANCE: No relocation assistance available 
CLEARANCE TYPE: None 
TRAVEL: No 
Description 
Peraton drives missions of consequence spanning the globe and extending to the farthest reaches of the galaxy. As the worlds leading mission capability integrator and transformative enterprise IT provider, we deliver trusted and highly differentiated national security solutions and technologies that keep people safe and secure. 
Peraton serves as a valued partner to essential government agencies across the intelligence, space, cyber, defense, civilian, health, and state and local markets. Every day, our 22,000 employees do the cant be done, solving the most daunting challenges facing our customers. 
 
Peraton is seeking a  Senior   Full Stack Angular Developer  to join our team of qualified, diverse individuals. The ideal candidate will have a solid understanding of front-end design, prototyping and converting wireframes to responsive web interfaces with Bootstrap. 
Responsibilities include (but not limited to) the following tasks: 
An Angular developer with hands-on experience building modern end to end web applications with Full Stack 
Senior level experience with Angular 4, and isomorphic JS applications with React.JS, Flux or Redux. 
Possess a solid understanding and experience in front-end design, prototyping and converting wireframes to responsive web interfaces with Bootstrap. 
Experience building high-performance server-side applications with Node eco-system. 
Experience with various automated testing tools to validate the application and build tools. Such as: Jasmine, selenium and Protractor. 
Experience developing modern responsive web applications with HTML5, CSS3, Bootstrap, LESS, SASS, etc. 
Hands-on experience using REST based APIs from Angular components and services. 
Basic Qualifications: 
Bachelors Degree in Computer Science or related field and 8+ years experience, or a masters degree in Computer Science or related field and 5 years of experience - OR - an additional 4 years of related experience in lieu of a Bachelor's Degree 
3+ years of experience with developing modular, test first Angular 2+ applications, isomorphic JS applications with ReactJS, Flux or Redux or similar. 
3 + years of experience working with Postgres, MySQL or MongoDB. 
5 + years of solid hands-on experience building Node.JS applications. 
3 + years of hands-on experience in using modern build tool chains and package managers (webpack, gulp, grunt, npm etc.) 
3 + years of experience working in agile environments with tools such as: Jira, Git, and Confluence. 
Preferred Qualifications: 
Experience working in government healthcare IT 
Experience working on projects for the Centers of Medicare and Medicaid Services. 
Experience working on Agile Scrum teams 
We are an Equal Opportunity/Affirmative Action Employer. We consider applicants without regard to race, color, religion, age, national origin, ancestry, ethnicity, gender, gender identity, gender expression, sexual orientation, marital status, veteran status, disability, genetic information, citizenship status, or membership in any other group protected by federal, state, or local law."
"Mobile/Web .Net Developers - Full time, 100% Remote - Tampa, FL 33610 - Indeed.com","**Please note these are permanent positions - Not looking for consultants or C2C. 
 Also NO sponsorship is available at this time 
 
 Location:  100% Remote 
 however, MUST reside in FL, GA, TN, TX, NC, or AL to be eligible 
 Duration:  full time employee 
 Salary:  negotiable, 70-115k depending on experience 
 
 Notes: 
 Mobile Full Stack .Net Developer with a front end focus 
 5 openings between senior, mid-level 
 Ideal profile: 5-8+ years that has worked in an Agile environment coding in .Net.
 Will take 3 years that is heavily design with mobile design. Can create micro interactions, cross function between mobile and web presence. 
 Most important: 
 .Net-Strong C#.
 UI skills-Front end work is important.
 Restful Services-API back end work secondary and more of a nice to have. 
 
 Background 
 Strong .Net experience required. If they have decent Flutter and light .Net will still consider. 
 More excited to see front end Developers than backend.
 MVC Core.net. Not heavy in SQL.
 4 teams currently with 20 members’ total. This will be a new team. 
 Microservices Cloud Services Azure is a plus. 
 Project: Redoing online banking for web and mobile. Mobile work will be done first in iOS/Android and backend microservices endpoint and APIs after. 
 New development Greenfield 100%, .Net C# Web and Mobile development. 
 70% Coding, 30% Meetings/Scrums/Ceremonies 
 
 Job Description 
 Specifies design, implements, tests, debugs, and supports software applications. Designs database integration services and front-end GUI code that support department procedures and standards. 
 
   Duties and Responsibilities 
 Works with internal departments to provide associated deliverables required for successful completion of mission critical applications. Gathers user requirements and translates them into functional application units. Works with central Web Team, internal content owners, or external contractors to develop application solutions. 
 Writes and modifies mission critical application code in a variety of platforms (.Net, Windows Azure, iOS, Android, Flutter), following department procedures and standards. 
 Designs and develops databases and unstructured data stores. 
 Develops knowledge of existing APIs with all desktop software used within the Credit Union. Develops knowledge of all Host-related communication mediums including Quest and PowerOn. 
 Troubleshoots programming problems, reading and interpreting application code. 
 Maintains all source code in centralized source code management tool. 
 Develops and maintains quality procedures and documentation. 
 Mentors Junior Programmer/Analysts. 
 May participate in Information Technology Division’s regular on-call rotation. 
 Attends job-specific training classes as requested by manager. Completes annual BSA/AML Compliance Training and understands employee’s role in maintaining an effective BSA/AML compliance program, and completes FACT Act Red Flag training. 
 
 Minimum Education, Experience, and Skill Requirements 
 Bachelor’s degree in Computer Science or related field. (A comparable combination of work experience and training may be substituted for education requirements.) 
 3 or more years of previous application development work experience. At least 1 year experience in .Net, and relational database design or NOSQL. 
 General knowledge and understanding of object-oriented programming and design principles. General knowledge and understanding of C# and Flutter. 
 Strong data analysis and integration skills. Strong critical thinking and problem-solving skills. 
 Able to document processes through flow-charts and specifications. 
 Able to prioritize tasks, deal effectively with competing and changing priorities, and meet deadlines. Accurate, detail-oriented, and organized. 
 General knowledge and understanding of products, services, policies, and procedures as they pertain to the job 
You should know:  Your safety matters! Vaccination against COVID-19 may be a requirement for this job in compliance with current client and governmental policies. A Kelly recruiter will confirm and share more details with you during the interview process.
 Why Kelly ® ? 
 By partnering with Kelly® Technology, you’ll have direct connections to top companies around the globe—giving you the chance to put your tech skills to work on some of today’s most intriguing, innovative, and high-visibility projects. In a world where change is the only constant, our unparalleled connections and IT market expertise help you take your skills exactly where you want to go. We’re here to help you gain experience, keep learning, and move your career forward. 
 About Kelly ® 
 At Kelly, we’re always thinking about what’s next and advising job seekers on new ways of working to reach their full potential. In fact, we’re a leading advocate for temporary/nontraditional workstyles, because we believe they allow flexibility and tremendous growth opportunities that enable a better way to work and live (plus, did we mention we provide a ton of benefits?). Connecting great people with great companies is what we do best, and our employment opportunities span a wide variety of workstyles, skill levels, and industries around the world.
 Kelly is an equal opportunity employer committed to employing a diverse workforce and providing accommodations for people with disabilities in all parts of the hiring process as required under its Employment Accommodation Policy. Kelly will work with applicants to meet accommodation needs that are made known to Kelly in advance. 
]]"
"Sr. Software Developer - Web Applications - Bellevue, WA - Indeed.com","Base2 Solutions,  (a Belcan Company) is a Bellevue, WA based technology consulting firm where each day offers new opportunities to learn, innovate, and have real impact. Base2 Solutions was selected by the Puget Sound Business Journal as one of 2020's Best Places to Work. For the sixth year in a row in Washington, this publication has recognized Base2 for its commitment to fostering an innovative culture and its dedication to providing employees with a great work experience. 
 Our headquarters are in downtown Bellevue, Washington with an additional office in Brea, California. 
 This position is  Remote.  Candidates local to the Puget Sound area is desired, but not required. 
 What we need: 
 
An experienced Software Developer with a proven track record of delivering software applications and systems. Someone who can participate in the full software development lifecycle as an individual contributor and as a member of a team.
 Qualifications: 
 
Deep knowledge of web applications.
 HTML, CSS, JavaScript, Node.js libraries.
 Extensive experience with Object Oriented languages like C++, Java, C#
 Experience with SQL and/or NoSQL database managers
 Extensive experience with scripting in one or more of Python, bash, ps1, bat
 Experience with software build, test, and deployment automation, preferably to cloud based environments.
 Experience with virtual machine and/or microservices environments. 
 Preferred Technical Stack experience and education: 
 
React JS, AngularJS, HTML, CSS, webpack
 NodeJS, Java, Java Spring Boot
 Linux, Docker, AWS, git, GitLab CI, Kubernetes, babel, jest build, test and deployment environments
 PostgreSQL, MySQL, MongoDB databases
 B.S degree in computer science, computer engineering, electrical engineering or related field 
 This is for direct hire only. We are not able to offer Visa sponsorship nor are we accepting contractors placed through agencies/other companies. 
 Base2 is committed to hiring and retaining a diverse workforce. We are an Equal Opportunity/Affirmative Action Employer and provide equal employment opportunity to all employees and applicants without regard to race/ethnicity, color, national origin, sex/gender, sexual orientation, religion, age, disability, veteran status, or any other protected status. Should you have questions regarding our Affirmative Action Plans or wish to view the available portions of the plans, please send an email to recruiting@base2s.com with your contact information.
 If you need a reasonable accommodation for any part of the employment process, please send an e-mail to recruiting@base2s.com and let us know the nature of your request, along with your contact information. Please note that only those inquiries concerning a request for reasonable accommodation or our Affirmative Action plan will be responded to from this e-mail address.
 This job description is Base2's general Sr. Software Developer - Web Applications position. A candidate's level will be evaluated during the interview process."
"REMOTE - Senior/Lead Front End Engineer - React - Austin, TX 78703 - Indeed.com","REMOTE - Senior/Lead Front End Engineer - React
 Backed by the former Lululemon CEO and a former Blackstone partner, we are an industry-leading company directly providing medical professionals with the highest quality medical apparel in the world! Along with recently doubling our annual revenue to over $200 million, we have donated thousands of scrubs to providers in over 35 countries!
 
 
As we grow our team, we are looking for passionate people who want to build long-term careers while visibly making a difference globally within the medical industry! 
What's In It for You Competitive Compensation Contingent On Experience
 100% Remote Opportunity
 Medical, dental, vision, and life insurance 401k + 6% matching Upcoming ESPP Generous PTO and paid holidays Parental and family medical leave An opportunity to be more than just an engineer and help medical professional globally! 
What You Need for this Position React Redux and/or Typescript
 Leadership experience
 Startup experience 
What You Will Be Doing Eventual pathway to Engineering Leadership but no direct reports to start
 Work on team-based projects or alone as needed Collaborate with Product, Engineering, and Design teams Contribute to the core themes and development of reusable component libraries Assist with the implementation of core data models that will support presented APIs Develop custom user-facing front end applications and eCommerce features 
So, if you have the experience above, please apply today or email me directly at edwin.ocampo@cybercoders.com! Applicants must be authorized to work in the U.S. 
 CyberCoders, Inc is proud to be an Equal Opportunity Employer 
 
 
All qualified applicants will receive consideration for employment without regard to race, color, religion, sex, national origin, disability, protected veteran status, or any other characteristic protected by law.
 
 
 Your Right to Work  – In compliance with federal law, all persons hired will be required to verify identity and eligibility to work in the United States and to complete the required employment eligibility verification document form upon hire."
"Senior Frontend Engineer - Los Angeles, CA 90066 - Indeed.com","Senior Frontend Engineer
 If you are a Senior Frontend Engineer with experience, please read on! 
 
We are a digital media agency working with incredible clients across the US! You have seen our work everywhere through the many awesome brands we work with. Our team is focused on delivering great ads and content that incorporate our own individual creativity! We are looking for a Senior Frontend Expert with an established background in react. If you are interesting in working with a growing media agency, then please join us! 
What You Will Be Doing 
As a Senior Frontend Engineer, you will work with out team on our clients' various websites that are seen by worldwide audiences. You will work with your team closely from concept phase to completion. 
What You Need for this Position 
MUST HAVE: 
 React Typescript
 HTML Template Knowledge: Jinja, Nunjucks, Moustache, Handlebars or others Node is in your toolbelt like with using Gulp or webpack CSS and Styled Components Some CMS exposure : Hubspot, Sanity.io, any other headless CMS 
Nice to have: 
 Node, Python understanding 
What's In It for You 
- $120,000 - $160,000 (depending on experience) 
- Vacation/PTO - you deserve breaks! 
 Medical Dental Vision 401k 
Benefits Vacation/PTO Medical Dental Vision 401k 
So, if you are a Senior Frontend Engineer with experience, please apply today! 
Colorado employees will receive paid sick leave. For additional information about available benefits, please contact Sydney Freeman Sacker Applicants must be authorized to work in the U.S. 
 CyberCoders, Inc is proud to be an Equal Opportunity Employer 
 
 
All qualified applicants will receive consideration for employment without regard to race, color, religion, sex, national origin, disability, protected veteran status, or any other characteristic protected by law.
 
 
 Your Right to Work  – In compliance with federal law, all persons hired will be required to verify identity and eligibility to work in the United States and to complete the required employment eligibility verification document form upon hire.
 
 
CyberCoders will consider for Employment in the City of Los Angeles qualified Applicants with Criminal Histories in a manner consistent with the requirements of the Los Angeles Fair Chance Initiative for Hiring (Ban the Box) Ordinance."
"Full Stack Web Developer - San Juan, PR - Indeed.com","Responsibilities Work with development teams and product managers to ideate software solutions Design client-side and server-side architecture Build the front-end of applications through appealing visual design Develop and manage well-functioning databases and applications Write effective APIs Test software to ensure responsiveness and efficiency Troubleshoot, debug and upgrade software Create security and data protection settings Build features and applications with a mobile responsive design Write technical documentation Work with data scientists and analysts to improve software Requirements Proven experience as a Full Stack Developer or similar role Experience developing web applications Familiarity with common stacks Knowledge of multiple front-end languages and libraries (e.g. HTML/ CSS, JavaScript, XML, jQuery) Knowledge of multiple back-end languages (e.g. C#, Java, Python) and JavaScript frameworks (e.g. Angular, React, Node.js) Familiarity with databases (e.g. SQL Server, MySQL, MongoDB), web servers (e.g. Apache, IIS) and UI/UX design Excellent communication and teamwork skills Great attention to detail Organizational skills An analytical mind Degree in Computer Science, Statistics or relevant field Job Types: Full-time, Commission Salary: From $45,000.00 per year Work Location: One location Benefits: Health insurance Professional development assistance Work Remotely: Temporarily due to COVID-19"
"Full Stack Web Developer (PHP / Docker / MySQL / Bootstrap) Cloud - Cloud, IA - Indeed.com","Job Description
 My Client, an international investment organization, who are developing a cloud-based Digital Banking and investment platform, are in the process of recruiting a Full Stack Web Developer to join the dynamic team and to work on innovative initiatives. 
Reference LASFSD001 
 Job description: 
 Design, development and test both applications and core service API’s around the current investment business and the new banking platform 
 Enhance and extend current software systems to cover newer business, reporting, compliance or risk requirements 
Responsibilities: 
 Integration and transformation of data from reporting departments, institutions or third parties 
 Collaborative architectural design and analysis of solutions 
 Manage and facilitate the control of data and information throughout the Group of companies 
 Ongoing security and stability assessments and software systems 
 Unit testing design and development, code review/sign off, automation testing tools and cusitomer journey improvement 
 Requirements (Qualifications and Skill) 
 o Backend: Programmin language PHP, Frameworks: Laravel or Symphony 
 o Frontend: JavaScript, HTML5, CSS, Bootstrap and JQuery – Anngular Framework 
 o Databases: MySQL or MariaDB 
 o Agile and dynamic development environments 
 o Can do approach and accountability as an individual and as part of a team 
 o Experience with TDD / Unit testing / PHPUnit or similar 
 o Experience in Banking, Investment or Fintech companies 
 o Experience in Microservices / Distributed System Design 
 o Experience in rich and dynamic web or mobile applications 
 o Experience with Docker, MongoDB / Cassandra, RabbitMQ / Kafka, Redis etc. 
If you wish to apply for the position directly, please  send your CV  to  Lisa Stroud  at  Lstroud@caglobalint.com 
Please visit  www.banking-recruitment-jobs.com   for more exciting opportunities. 
Lisa Stroud 
Senior Associate 
Banking, Finance & Information Technology 
 CA Global Finance will respond to short-listed candidates only. If you have not had any response in two weeks, please consider your application unsuccessful, however your CV will be kept on our database for any other suitable positions. 
 
 
 
 
 
 
 
 About Company 
 CA Global Headhunters is an international staffing company with a specific focus on recruitment in Africa. Our extensive, diverse candidate network built up over 10 years comprises the most skilled and experienced candidates. We recruit talent of the highest standards across African sectors, including Mining, Oil & Gas, Engineering, Banking, Finance, Legal, Insurance, Commodities, and Agriculture. As African markets continue to grow and develop, so too does our skill and expertise, ensuring that we deliver the best service to both clients and candidates. 
 Thanks to our access to global networks and resources, we understand our clients’ cultures, operations, business strategies, and industries. We are always on par with the latest technologies and trends which assist us in sourcing the best talent for clients. Whatever stage of the project lifecycle, we can put forward the right candidates with the right skills. 
 
 
 Apply for this Job"
Web Developer - Remote - Indeed.com,"Web Developer Job Description As a Web Developer at Marathon, you will be an Information Technology Consultant to our wide variety of clients. In addition to supporting our clients, you will be joining our Digital Marketing Team – a collaborative, supportive, and talented group that provides a feeling of community. Your Digital Marketing Teammates will include developers, designers, digital strategist, and project managers. The work will be diversified, challenging and very rewarding. Our wide variety of projects will allow you to continuously grow and optimize your skill sets. You will have opportunities to learn and work with new technologies and development tools, allowing you to stay up to date on all the latest technology trends. In addition to a competitive salary, paid time off, and bonus opportunities, Marathon will also be providing you a healthy work-life balance and the flexibility to work remote. You will receive our Health Care package, which pays 100% of the employee premium, a competitive 401K match program, professional training, and the opportunity for tremendous growth. Web Developer Responsibilities:  You will be joining our Digital Marketing Team which is responsible for developing and implementing high volume, complex marketing, and eCommerce websites for our wide variety of clients. From intuitive information architecture to visually appealing UI, we implement streamlined, functional, and responsive websites for the best user experience and successful ROI. Develop and implement high volume, complex marketing, and eCommerce websites. Develop User Interfaces using HTML, CSS, and JavaScript/JQuery. Implement and customize Content Management Systems (CMS) such as Umbraco, Ektron, Concrete5, Drupal, WordPress, etc. Implement responsive designs using Bootstrap, Angular, React, Vue, and/or other frameworks. Mentor junior developers on best practices. Liaise with graphic designers, digital strategist and project managers to ensure the best user experience and ROI for our clients. Web Developer – Required Skills 7+ years of experience with HTML, CSS, and JavaScript/JQuery. 5+ years developing HTML layouts using advanced CSS techniques with a focus on web standards and usability. 5+ years’ experience developing websites and implementing Content Management Systems (CMS) with programming languages such as C#, .NET, ASP.NET, and/or VB.NET. Strong knowledge of current web design principles, Search Engine Optimization (SEO), responsive website development, and usability standards. Excellent written and oral communication skills. Ability to work with all levels of client staff and management. Desired, but not required:  Experience with Umbraco (Content Management System). Marathon Consulting LLC., is an equal opportunity employer and will not discriminate against any employee or applicant on the basis of age, color, disability, gender, national origin, race, religion, sexual orientation, veteran status, or any classification protected by federal, state, or local law. Job Type: Full-time Benefits: 401(k) 401(k) matching Dental insurance Employee assistance program Employee discount Flexible schedule Flexible spending account Health insurance Health savings account Life insurance Paid time off Parental leave Professional development assistance Referral program Relocation assistance Vision insurance Schedule: Monday to Friday Supplemental Pay: Bonus pay Signing bonus Experience: C#/.NET/ASP.NET/VB.NET: 1 year (Required) JavaScript/jQuery: 2 years (Required) HTML/CSS: 2 years (Required) Work Location: Remote"
