Title,Description
"Senior Software Engineer - Front End - Houston, TX 77001 - Indeed.com","Please note that visa sponsorship is not available for this position. 
Your Opportunity 
New Relic’s Network Performance Monitoring functionality bridges the telemetry gap between applications and infrastructure in a single observability platform. Our goal is to democratize access to data for all engineers to accelerate both innovation and problem resolution. 
As a member of this team, you will obsess over the details of how our customers experience their data within the New Relic One platform. You will be empathetic to ITOps, DevOps, and NoOps alike because every engineer matters, especially when network performance is in question. 
The Network Performance Monitoring team has a mandate to innovate quickly and delight customers with intuitive adoption and exploration experiences. We want engineers who have a history of embracing challenges as a way to learn, collaborating across teams, and wondering why everyone keeps talking about “out of the box” thinking because you didn’t even know that boxes existed. 
What You’ll Do 
We're searching for someone who can help evolve our team with their passion and experience in building outstanding software and empowering others. You will have the opportunity to: 
Build meaningful user experiences that have real customer impact through thoughtful, high-quality code that is easy to read and maintain 
Implement rich, interactive data visualizations using modern JavaScript and software development techniques in partnership with the other engineers on the team 
Lead development efforts to support our growing UI for customers and internal teams 
Solve complex use cases that require close collaboration with product management, product design, and engineering teams 
Increase the impact of one or more team members through mentoring, pairing, and support 
Your Qualifications 
Must-have: 
5+ years professional software development experience 
2+ years experience with the React framework writing performant and reusable components and tests, with solid understanding of modern JavaScript and React 
A deep understanding of methodologies and design patterns for JavaScript and knowledge of how to keep the code modular and loosely coupled. 
Experience querying data from a variety of sources such as GraphQL, REST APIs, or key/value data stores 
Experience with breaking down product requirements into architecture design and implementation 
Experience working with Git, and workflows around it, such as reviewing PRs and applying proven methodologies. 
Collaborative working style that includes colleagues in important decisions and leads to shared code ownership 
Experience leading collective efforts of the team to deliver on consistent usability and reliability 
You enjoy mentoring others 
Nice-to-have: 
 
Demonstrated knowledge of data visualization for the Ops persona such as Sankey, geo-maps, and other tactical experiences 
Cloud Computing: compute, storage, and analytics with AWS, GCP, or Azure 
Experience with or exposure to open source databases like PostgreSQL 
Experience with test automation tools 
Please note that visa sponsorship is not available for this position. 
We're looking for bold and passionate people to be a part of our mission to create more perfect software. We'd love to have you apply, even if you don't feel you meet every single requirement. What's most important to us is finding authentic and accountable people who feel connected to our mission and values, not just candidates who check off all the boxes. 
 
We believe in empowering all Relics to achieve professional, and business success through a workforce model called Flex First. The Flex First model allows us to work in a variety of workplaces that best support our success, including fully office-based, fully remote, or a combination of both. 
 
Read more about Flex First and New Relic’s vaccine policy as part of our commitment to maintaining a safe and healthy workplace in light of the COVID-19 pandemic. 
About Us 
New Relic (NYSE: NEWR) is a cloud-based observability platform that gives developers, engineers, operations, and management a clear view of what’s happening in today’s complex software environments. So they can find and fix problems faster, and deliver delightful experiences for their customers. That's why the world’s best engineering teams rely on New Relic to visualize, analyze, and troubleshoot their software. It’s the simplest, most powerful cloud-based observability platform, built to create more perfect software. All from one place. 
Founded in 2008, we’re a global company passionate about building a culture where all employees feel a deep sense of belonging, where every ‘Relic’ can bring their whole self to work and feel supported and empowered to thrive. We’re consistently recognized as a distinguished employer and are committed to building world-class products and an award-winning culture. For more information, visit newrelic.com. 
Our Hiring Process 
New Relic takes seriously our stewardship of the data of our thousands of customers worldwide. In compliance with applicable law, all persons hired will be required to verify identity and eligibility to work and to complete employment eligibility verification. 
We will consider qualified applicants with arrest and conviction records based on individual circumstances and in accordance with applicable law including, but not limited to, the San Francisco Fair Chance Ordinance. https://sfgov.org/olse/sites/default/files/FCO%20poster2020.pdf 
Headhunters and recruitment agencies may not submit resumes/CVs through this website or directly to managers. New Relic does not accept unsolicited headhunter and agency resumes, and will not pay fees to any third-party agency or company that does not have a signed agreement with New Relic. 
New Relic is an equal opportunity employer. We eagerly seek a diverse applicant pool and hire without regard to race, color, gender identity, religion, national origin, ancestry, citizenship, physical abilities (or disability), age, sexual orientation, veteran status, or any other characteristic protected by law. 
Interested in the details of our privacy policy? Read more here: https://newrelic.com/termsandconditions/applicant-privacy-policy 
 
 #LI-JH1"
"React.js Developer - Billings, MT - Indeed.com","At least 3 years experience in ReactJS framework
 
Must have worked in customer-facing applications in the past
 
Able to develop new features and reusable components in react for large scalable customer-facing applications
 
Very good understanding of React.js and its core principles
 
Strong skills in web core components such as HTML, CSS, and Javascript frameworks.
 
Experience with popular React.js state managers such as Redux
 
Nice to have React Native app building experience
 
Proven skills in implementing user experience flow in web applications
 
Ability to build the frontend from API-driven microservice-based backend.
 
Knowledge of react native development on mobile is a plus
 
Experience in Photoshop or similar design tools is an added advantage
 
Best Regards.
 Stuart."
"Frontend Software Engineer - Seattle, WA 98104 - Indeed.com","Overview:
 
Frontend Software Engineer 
 Remote in the US! 
 Start ASAP 
 Salary Range: $64,113.00 - $85,484.00 annual 
Summary 
Our client is a leading IT consulting firm specializing in the optimization of complex end-to-end business process systems for a multitude of business verticals including Financial Services, Digital Media, Healthcare, and Transportation industries. 
The Software Engineer II will have a solid knowledge of database concepts and software development tools. They will work closely with other Software Engineers, Business Systems Analysts, and business stakeholders to develop and maintain mobile solutions. 
Duties and Responsibilities 
Collaborate with business systems analysts and internal business users to develop solutions based on requirements 
Design, build, and maintain efficient, reusable, and robust code while using source control to manage code across all environments 
Write code at all tiers from persistence to middle tier to frontend 
Troubleshoot, analyze, and debug application issues 
Proficiently skilled at optimizing and refactoring existing code to increase responsiveness, performance, and maintainability 
Participates and assists in code reviews and quality assurance processes 
Adheres to and support ODS policies and procedures 
Adheres to and support coding standards and best practices 
Uphold and maintain conceptual, logical, and physical application architectures 
Qualifications & Requirements 
Bachelor’s degree in Computer Science or similar field 
A demonstrated expertise in Object Oriented Analysis and Design 
Excellent ability to read and create high performance SQL queries 
Excellent ability in unit testing/test-driven development 
Excellent ability to develop in MVC-based frameworks in C# or Python 
Excellent ability to develop in frontend technologies (React, Angular, and Vue) 
General knowledge of utilizing SOAP and/or REST APIs 
Please submit your resume to be considered! 
#4"
"Lead UI Developer - Charlotte, NC 28202 - Indeed.com","General information
 Career area
 Technology
 Work Location(s)
 601 S. Tryon Street, Charlotte, NC
 Remote?
 No
 Ref #
 21-6674
 Posted Date
 Sunday, August 1, 2021
 Working time
 Full-time
 Ally and Your Career
 Ally Financial only succeeds when its people do - and that’s more than some cliché people put on job postings. We live this stuff! We see our people as, well, people - with interests, families, friends, dreams, and causes that are all important to them. Our focus is on the health and safety of our teammates as well as work-life balance and diversity and inclusion. From generous benefits to a variety of employee resource groups, we strive to build paths that encourage employees to stretch themselves professionally. We want to help you grow, develop, and learn new things. You’re constantly evolving, so shouldn’t your opportunities be, too?
 The Opportunity
 Seeking an innovative and passionate Tech Lead to manage key components of Ally's next generation Customer Communication Platform. The ideal candidate will possess technical leadership experience and is passionate about delivering a quality user experience and relevant messaging to millions of Ally customers across delivery channels and lines of business. Candidates should have experience working in the customer communications space and possess attention to detail and a track record of flawless execution. 
 The Work Itself
 As a Tech Lead, you will help champion your team on its journey to implement and launch personalized messaging integrations and campaigns to customers across the Ally enterprise. 
Partner with business, UX design and back-end API teams to stand up alerting capabilities across delivery channels of email, sms/mms and push notifications 
Guide development teams to review business requirements, design documents, test plans/test cases 
Partner with architecture and external development teams to design technical solutions 
Lead the development and deployment of new features with your team 
Recommend optimizations for improved efficiency and speed to market for new alerting capabilities 
Enforce performance & code quality standards through peer code reviews and automated testing 
Assist with hiring, onboarding and mentoring of new developers for your team 
 The Skills You Bring
  5+ years of related experience with a bachelor's degree in a technical field, or an equivalent combination of experience and education 
Technical Skills 
Expert level experience with HTML5 and CSS3 
Expert level experience with JavaScript/ES6/Typescript 
Experience designing data models with JSON / JSON Schema 
Experience with relational databases including DDL and DML 
Strong working experience with at least one JavaScript framework - React, Vue, Angular, Ember, etc. 
Strong working experience with version control (Git/Bitbucket) and branching strategies 
Experience building and deploying applications using AWS Serverless technology S3, Lambda, Elasticache, etc. 
Experience with Jenkins, Terraform and related cicd/deployment tools and techniques 
Experience with tools and techniques to ensure compatibility of rendering of content across browsers, clients and form factors. 
Experience working with email marketing / messaging / campaign management platforms and vendors 
Experience with JavaScript testing frameworks - BDD & cucumber 
Experience with publishing and consuming REST API 
Experience with coding standards for Accessibility 
Enterprise exposure in defect analysis and resolution 
Behavioral & Communication Skills 
Superb communication skills at all levels, from team members to senior management 
Must have the ability to work in a team within an Agile operating model 
Ability to exchange constructive and respectful feedback 
Vigilant attention to detail with an understanding that our platforms communicate to large number of customers 
Must be able to help communicate ideas and standard methodologies to more junior developers 
Must be able to collaborate with wider groups on standards and best practices 
Enthusiasm and a desire to be part of an innovative team 
A commitment to quality, and a desire to improve 
Ally Overview 
 How We'll Have Your Back
 Ally's compensation program offers market-competitive base pay and pay-for-performance incentives (bonuses) based on achieving personal and company goals. But Ally’s total compensation – or total rewards – extends beyond your paycheck and is designed to support and enrich your personal and professional life, including: 
Time Away:  competitive holiday and flexible paid-time-off, including time off for volunteering and voting. 
Planning for the Future:  plan for the near and long term with an industry-leading 401K retirement savings plan with matching and company contributions, student loan and 529 educational assistance programs, tuition reimbursement, and other financial well-being programs. 
Supporting your Health & Well-being:  flexible health and insurance options including dental and vision, pre-tax Health Savings Account with employer contributions and a total well-being program that helps you and your family stay on track physically, socially, emotionally, and financially. 
Building a Family:  adoption, surrogacy, and fertility support as well as parental and caregiver leave, back-up child and adult/elder day care program and childcare discounts. 
Work-Life Integration:  other benefits including LifeMatters® Employee Assistance Program, subsidized and discounted Weight Watchers® program and other employee discount programs. 
Who We Are: 
Ally Financial is a customer-centric, leading digital financial services company with passionate customer service and innovative financial solutions. We are relentlessly focused on ""Doing it Right"" and being a trusted financial-services provider to our consumer, commercial, and corporate customers. For more information, visit www.ally.com. 
Ally is an equal opportunity employer committed to diversity and inclusion in the workplace. All qualified applicants will receive consideration for employment without regard to age, race, color, sex, religion, national origin, disability, sexual orientation, gender identity or expression, pregnancy status, marital status, military or veteran status, genetic disposition or any other reason protected by law. 
Where permitted by applicable law, must have received or be willing to receive the COVID-19 vaccine by date of hire to be considered, if not currently employed by Ally. 
We are committed to working with and providing reasonable accommodation to applicants with physical or mental disabilities. For accommodation requests, email us at work@ally.com. Ally will not discriminate against any qualified individual who is capable of performing the essential functions of the job with or without reasonable accommodation."
"Drupal Web Developer - Glendale, AZ 85303 - Indeed.com","Candidates in search of a new opportunity will be interested in Robert Half'Microsoft open Web Developer position. The ideal candidate for this position has a strong command of enterprise systems, an excellent coding skillset and the ability to think outside the box. Find out more about this role by calling today. You could play a pivotal role in bringing projects to life! This Web Developer position is located in the Glendale, Arizona area and is a short-term contract / temporary employment opportunity.
 
What you get to do every day
 
Collaborate with key partners to deliver on time tested and reusable code in a rapidly changing environmentDrive and code solutions creativelyAnalyze complex business processes and develop simple solutions using best of breed toolsIdentify business needs and ensure solutions align with the company goalsWork with leadership and others to find the right solutions
 
 
 Recent experience with server-side languages 
 A love for creating full service end-to-end solutions that are the foundation for great customer experiences 
 3+ years experience with both front-end and back-end technologies in a B2B or B2C web production environment- Experience caring for the technical needs of sites, apps and integrations with high volume traffic 
 Foundational knowledge of compatibility and cross-browser issues 
 Skills in HTML and CSS 
 Knowledge of various web languages and the ability to move quickly from project mockups into full-fledge versions in that software 
 Content Management System (CMS) experience 
 Digital Video experience 
 Website Design experience 
 Drupal experience 
 Rooted understanding of how a mobile user experience differs from the experience on a web or other application 
 
Technology Doesn't Change the World, People Do.®
 
Robert Half is the world’s first and largest specialized talent solutions firm that connects highly qualified job seekers to opportunities at great companies. We offer contract, temporary and permanent placement solutions for finance and accounting, technology, marketing and creative, legal, and administrative and customer support roles.
 
Robert Half puts you in the best position to succeed by advocating on your behalf and promoting you to employers. We provide access to top jobs, competitive compensation and benefits, and free online training. Stay on top of every opportunity – even on the go. Download the Robert Half app and get 1-tap apply, instant notifications for AI-matched jobs, and more.
 
Questions? Call your local office at  1.888.490.4429 . All applicants applying for U.S. job openings must be legally authorized to work in the United States. Benefits are available to contract/temporary professionals. Visit https://roberthalf.gobenefits.net/ for more information.
 
© 2021 Robert Half. An Equal Opportunity Employer. M/F/Disability/Veterans. By clicking “Apply Now,” you’re agreeing to Robert Half’s Terms of Use ."
"UI/UX Designer / Developer - Boston, MA - Indeed.com","Work with product managers, developers, and business stakeholders to help set product direction. 
 Design advanced data visualizations and/or BI Dashboards to support the needs of internal and external stakeholders. 
 Produce design visualizations that help stakeholders across disciplines understand what the best experience looks like: storyboards, user-flows, wireframes, mockups, prototypes, etc. 
 Work with internal stakeholders to understand their business 
 Create flexible designs and work flows that allow the interface to easily adapt and change based on new products delivered. 
#INDEXP 
Requirements 
Industry experience includes –
 5+ years of related design experience; Working across a large organization with varying technical skill levels. Ability to work deep in the trenches with cross-functional teams on product design and ownership. 
Experience with –
 UX research, including planning, designing and facilitating user sessions and client & stakeholder workshops and design sprints, analyzing findings and articulating results Information architecture, user and screen flows, conceptual and detailed wireframing and prototyping Ensure all design documentation is created holistically with the client vision and cross-functional needs Knowledge bases and how to effectively structure them to present the optimal data and results. Working in a wide variety of modern design tools like Sketch, Figma, Adobe XD, Marvel Principle, and InVision Reviewing existing systems and processes to identify UX issues and develop UX recommendations 
Your online portfolio – Showcases your experience, storytelling and design presentation skills Demonstrates strong design judgement and an ability to solve nebulous UX problems Showcases your projects with a breadth of diverse projects and challenges Focuses on your guiding design principles and techniques 
The ability to –
 Approach design challenges with curiosity and a willingness to learn Produce “pixel perfect” design files Organize and self-direct to get things done Communicate your ideas in an efficient manner Work independently and in groups as needed 
Preferred: Experience contracting in agile methodology Qualitative and quantitative research methodologies Experience working in ad-tech or mar-tech Experience with BI & data viz tools like Tableau, Adobe Analytics, Datorama, etc.
 Surface knowledge of HTML5/CSS3 and FE frameworks like Bootstrap, etc. 
Experience working in a consulting environment"
